Issuer_Name,State_Abb,Jurisdiction_Type,Entity_Type,Controlling_Jurisdiction,Ultimate_Political_Jurisdiction,lat,lng,formatted_address,place_id,location_type,geo_source,match_method
Santa Clara Valley Water District Safe Clean Water Revenue,CA,SPECIAL_DISTRICT,Special district,Santa Clara Valley,Santa Clara Valley,37.2483293,-121.8735696,"5750 Almaden Expy, San Jose, CA 95118, USA",ChIJFe4-5fYzjoARi8_uHMstwg4,ROOFTOP,GoogleGeocodingAPI,FUZZY_ISSUER
Santa Clarita Public Finance Authority,CA,CITY,Financing authority,Santa Clarita,City of Santa Clarita,34.3916641,-118.542586,"Santa Clarita, CA, USA",ChIJJxjVrDOGwoARSNYFc-CPSlY,APPROXIMATE,GoogleGeocodingAPI,EXACT_UPJ
Santa Cruz County Capital Financing Authority,CA,COUNTY,Financing authority,Santa Cruz County Capital,Santa Cruz County Capital,37.04539949999999,-121.9579573,"Santa Cruz County, CA, USA",ChIJfzsx1n8TjoARGbNHDCbAPhU,APPROXIMATE,GoogleGeocodingAPI,FUZZY_ISSUER
Santa Monica Public Financing Authority,CA,CITY,Financing authority,Santa Monica,City of Santa Monica,34.0118372,-118.4914918,"1685 Main St, Santa Monica, CA 90401, USA",ChIJP_fH5NOkwoARRYzCVLJyVzs,ROOFTOP,GoogleGeocodingAPI,EXACT_UPJ
Sayreville School District,NJ,SCHOOL_DISTRICT,School district,Sayreville,Sayreville,40.4592422,-74.347017,"Sayreville Borough School District, Sayreville, NJ, USA",ChIJB4QOrULJw4kRJywZWvkko4s,APPROXIMATE,GoogleGeocodingAPI,EXACT_ISSUER
Schertz/Seguin Local Government Corp,TX,MULTI_JURISDICTIONAL,Development corporation,Schertz and Seguin (TX),Schertz and Seguin (TX),29.5706112,-97.9651452,"108 W Mountain St, Seguin, TX 78155, USA",ChIJq6qqqgm4XIYRCHnoEDPFaDo,ROOFTOP,GoogleGeocodingAPI,FUZZY_ISSUER
School District of Philadelphia/The,PA,SCHOOL_DISTRICT,School district,Philadelphia,Philadelphia,39.9528,-75.1634833,"1400 John F Kennedy Blvd, Philadelphia, PA 19107, USA",ChIJyb-70KChxokR5YR1l-Nka5s,ROOFTOP,GoogleGeocodingAPI,FUZZY_UPJ
Scott County School District Finance Corp,KY,SCHOOL_DISTRICT,School district,Scott County,Scott County,38.3172361,-84.56414699999999,"Scott County School District, KY, USA",ChIJFcUFGcI9QogRMZf5-FWA35g,APPROXIMATE,GoogleGeocodingAPI,EXACT_ISSUER
Seminole Improvement District,FL,SPECIAL_DISTRICT,Special district,Seminole,Seminole,27.6648274,-81.5157535,"Florida, USA",ChIJvypWkWV2wYgR0E7HW9MTLvc,APPROXIMATE,GoogleGeocodingAPI,EXACT_ISSUER
Shakopee Independent School District No 720,MN,SCHOOL_DISTRICT,School district,Shakopee,Shakopee,44.7973962,-93.5272861,"Shakopee, MN, USA",ChIJ2cWktVgM9ocRmuScS_2coLE,APPROXIMATE,GoogleGeocodingAPI,FUZZY_ISSUER
Shamokin-Coal Township Joint Sewer Authority,PA,MULTI_JURISDICTIONAL,Authority/Agency,Shamokin-Coal Township,Shamokin-Coal Township,40.8122505,-76.5833195,"114 Bridge St, Shamokin, PA 17872, USA",ChIJUzbNpYhdz4kRA17IMZezNpI,ROOFTOP,GoogleGeocodingAPI,EXACT_ISSUER
Shell Rock River Watershed District,MN,SPECIAL_DISTRICT,Special district,Shell Rock River area (MN),Shell Rock River area (MN),43.6474835,-93.3794027,"305 S 1st Ave, Albert Lea, MN 56007, USA",ChIJdaR4dY028YcRorPnPTNKTVs,ROOFTOP,GoogleGeocodingAPI,EXACT_ISSUER
Sienna Parks & Levee Improvement District of Fort Bend County,TX,SPECIAL_DISTRICT,Special district,Fort Bend County,Fort Bend County,29.5914433,-95.6293253,"202 Century Square Blvd, Sugar Land, TX 77478, USA",ChIJtT6FiLzmQIYRmICDlss56QQ,ROOFTOP,GoogleGeocodingAPI,EXACT_ISSUER
Silicon Valley Clean Water,CA,MULTI_JURISDICTIONAL,Special district,"Redwood City, San Carlos, Belmont, West Bay SD","Redwood City, San Carlos, Belmont, West Bay SD",37.5448113,-122.2283184,"1400 Radio Rd, Redwood City, CA 94065, USA",ChIJadb2zOyYj4ARN57UWXLRLuo,ROOFTOP,GoogleGeocodingAPI,EXACT_ISSUER
Snake River Water District,CO,SPECIAL_DISTRICT,Special district,Snake River,Snake River,39.6071,-105.9491802,"0050 Oro Grande Dr, Dillon, CO 80435, USA",ChIJ2d8mHABXaocR7gO7cwRxk1U,ROOFTOP,GoogleGeocodingAPI,EXACT_ISSUER
Sonoma-Marin Area Rail Transit District,CA,MULTI_JURISDICTIONAL,Special district,Sonoma and Marin Counties,Sonoma and Marin Counties,38.3720664,-122.716529,"Sonoma Marin Area Rail Transit, California, USA",ChIJTzHF_2NNhIAR05NqqlG9-XE,GEOMETRIC_CENTER,GoogleGeocodingAPI,EXACT_ISSUER
South Bayside Waste Management Authority,CA,MULTI_JURISDICTIONAL,Authority/Agency,South Bay municipalities (CA),South Bay municipalities (CA),33.6173267,-117.8994485,"S Bayside Way, Newport Beach, CA 92660, USA",ChIJTX3-bnXg3IAR0zi5_TwWjj0,GEOMETRIC_CENTER,GoogleGeocodingAPI,EXACT_ISSUER
South Carolina Jobs-Economic Development Authority,SC,STATE,Development corporation,South Carolina,State of South Carolina,34.0000786,-81.0329971,"1100 Gervais St, Columbia, SC 29208, USA",ChIJz4zptSu7-IgRAIfvt0XSF4s,ROOFTOP,GoogleGeocodingAPI,EXACT_UPJ
South Carolina State Housing Finance & Development Authority,SC,STATE,Development corporation,South Carolina,State of South Carolina,34.0000786,-81.0329971,"1100 Gervais St, Columbia, SC 29208, USA",ChIJz4zptSu7-IgRAIfvt0XSF4s,ROOFTOP,GoogleGeocodingAPI,EXACT_UPJ
South Central Connecticut Regional Water Authority,CT,MULTI_JURISDICTIONAL,Regional commission,South Central Connecticut,South Central Connecticut,41.2890565,-72.92499289999999,"90 Sargent Dr, New Haven, CT 06511, USA",ChIJ_____7vZ54kRWRB-uY9vJdw,ROOFTOP,GoogleGeocodingAPI,EXACT_ISSUER
South Dakota Conservancy District,SD,STATE,State agency,South Dakota,State of South Dakota,44.3671406,-100.3463686,"500 E Capitol Ave, Pierre, SD 57501, USA",ChIJ5YqLKBwSgIcR7TKW4hV7ewg,ROOFTOP,GoogleGeocodingAPI,EXACT_UPJ
South Dallas Water Authority Inc,TX,SPECIAL_DISTRICT,Special district,South Dallas,South Dallas,32.7762719,-96.7968559,"Dallas, Dallas County, Texas, United States",,,Nominatim/OSM,EXACT_ISSUER
South Georgia Governmental Services Authority,GA,MULTI_JURISDICTIONAL,Authority/Agency,South Georgia municipalities,South Georgia municipalities,32.1574351,-82.90712300000001,"Georgia, USA",ChIJV4FfHcU28YgR5xBP7BC8hGY,APPROXIMATE,GoogleGeocodingAPI,EXACT_ISSUER
South Middleton Township Municipal Authority,PA,CITY,Authority/Agency,South Middleton Township,South Middleton Township,40.1310492,-77.1600201,"South Middleton Township, PA, USA",ChIJX3ET-R0HyYkR1JkESaZfee8,APPROXIMATE,GoogleGeocodingAPI,EXACT_UPJ
South Ripley Community Multi-School Building Corp,IN,SCHOOL_DISTRICT,School district,South Ripley (IN),South Ripley (IN),39.0511054,-85.2484588,"1589 S Benham Rd, Versailles, IN 47042, USA",ChIJ6XsIFnNoaogR6N7TFpdgyfI,ROOFTOP,GoogleGeocodingAPI,EXACT_ISSUER
Southeast Arkansas College,AR,STATE,Public university,Arkansas,State of Arkansas,34.7469598,-92.28905,"500 Woodlane St, Little Rock, AR 72201, USA",ChIJlak53Fu70ocR-0-Av2EQh3c,ROOFTOP,GoogleGeocodingAPI,EXACT_UPJ
Southeast Williamson County Municipal Utility District No 1,TX,SPECIAL_DISTRICT,Special district,Southeast Williamson County,Southeast Williamson County,30.7591685,-97.6982272,"Williamson County, TX, USA",ChIJmaNjTwxHW4YRKTlbS_ZU6JM,APPROXIMATE,GoogleGeocodingAPI,FUZZY_ISSUER
Southern California Public Power Authority,CA,MULTI_JURISDICTIONAL,Public utility,Multiple Southern California municipalities,Multiple Southern California municipalities,34.117891,-117.822534,"1160 Nicole Ct, Glendora, CA 91740, USA",ChIJsYKA_k4vw4ARluEbNsihonU,ROOFTOP,GoogleGeocodingAPI,EXACT_ISSUER
Southern Sandoval County Arroyo Flood Control Authority,NM,SPECIAL_DISTRICT,Special district,Southern Sandoval County,Southern Sandoval County,35.2397311,-106.7006653,"1041 Commercial Dr SE, Rio Rancho, NM 87124, USA",ChIJa34Fez9wIocRpBAVCuj0egE,ROOFTOP,GoogleGeocodingAPI,EXACT_ISSUER
Southside Public Water Authority,AR,SPECIAL_DISTRICT,Special district,Southside Public,Southside Public,35.720124,-91.6364532,"1401 Batesville Blvd, Batesville, AR 72501, USA",ChIJk3kpiP7a04cRvHrfLmFul48,ROOFTOP,GoogleGeocodingAPI,EXACT_ISSUER
Southwest Water Users Public Water Authority of the State of Arkansas,AR,SPECIAL_DISTRICT,Special district,Southwest Water Users Public,Southwest Water Users Public,35.20105,-91.8318334,"Arkansas, USA",ChIJYSc_dD-e0ocR0NLf_z5pBaQ,APPROXIMATE,GoogleGeocodingAPI,EXACT_ISSUER
Spartanburg County School District No 7,SC,SCHOOL_DISTRICT,School district,Spartanburg County,Spartanburg County,34.9555411,-81.89890799999999,"Spartanburg School District 7, SC, USA",ChIJX99VOGN1V4gRYq8ZOJn3H8c,APPROXIMATE,GoogleGeocodingAPI,FUZZY_ISSUER
St Helena Financing Authority,CA,CITY,Financing authority,St Helena,City of St Helena,38.5098549,-122.4566934,"1088 College Ave, St Helena, CA 94574, USA",ChIJJ7BPdABRhIARVubQrGiD-rU,ROOFTOP,GoogleGeocodingAPI,FUZZY_UPJ
St Louis Clean Energy Development Board,MO,CITY,Development corporation,St Louis,City of St Louis,38.626704,-90.1990425,"1200 Market St, St. Louis, MO 63103, USA",ChIJwYdFzBaz2IcRlRX7LjPCq2c,ROOFTOP,GoogleGeocodingAPI,FUZZY_UPJ
St Louis Municipal Finance Corp,MO,CITY,Financing authority,St Louis,City of St Louis,38.626704,-90.1990425,"1200 Market St, St. Louis, MO 63103, USA",ChIJwYdFzBaz2IcRlRX7LjPCq2c,ROOFTOP,GoogleGeocodingAPI,FUZZY_UPJ
Stark Metropolitan Housing Authority,OH,MULTI_JURISDICTIONAL,Regional commission,Stark County,Stark County,40.8684676,-81.2518833,"Stark County, OH, USA",ChIJGXvF_is9N4gRTUq22ZuY1S4,APPROXIMATE,GoogleGeocodingAPI,EXACT_UPJ
State of Arkansas,AR,STATE,Direct government,Arkansas,State of Arkansas,34.7469598,-92.28905,"500 Woodlane St, Little Rock, AR 72201, USA",ChIJlak53Fu70ocR-0-Av2EQh3c,ROOFTOP,GoogleGeocodingAPI,EXACT_ISSUER
State of California,CA,STATE,Direct government,California,State of California,38.5765882,-121.4932368,"California State Capitol Museum, 1315 10th St, Sacramento, CA 95814, USA",ChIJldtsqgTWmoAR1aSB8REJQgU,ROOFTOP,GoogleGeocodingAPI,EXACT_ISSUER
State of California Department of Water Resources,CA,STATE,Department,California,State of California,38.5765882,-121.4932368,"California State Capitol Museum, 1315 10th St, Sacramento, CA 95814, USA",ChIJldtsqgTWmoAR1aSB8REJQgU,ROOFTOP,GoogleGeocodingAPI,EXACT_UPJ
State of Connecticut,CT,STATE,Direct government,Connecticut,State of Connecticut,41.7656159,-72.6695572,"Capitol Planning Region, CT, USA",ChIJl-MOLQBY5okR6480TjQjz4g,APPROXIMATE,GoogleGeocodingAPI,EXACT_ISSUER
State of Connecticut Clean Water Fund - State Revolving Fund,CT,STATE,Trust/Fund,Connecticut,State of Connecticut,41.7656159,-72.6695572,"Capitol Planning Region, CT, USA",ChIJl-MOLQBY5okR6480TjQjz4g,APPROXIMATE,GoogleGeocodingAPI,EXACT_UPJ
State of Hawaii,HI,STATE,Direct government,Hawaii,State of Hawaii,21.3072405,-157.8574296,"415 S Beretania St., Honolulu, HI 96813, USA",ChIJ__8PWnVuAHwRgHWIJ-cFceY,ROOFTOP,GoogleGeocodingAPI,EXACT_ISSUER
State of Hawaii Department of Business Economic Development & Tourism,HI,STATE,Department,Hawaii,State of Hawaii,21.3072405,-157.8574296,"415 S Beretania St., Honolulu, HI 96813, USA",ChIJ__8PWnVuAHwRgHWIJ-cFceY,ROOFTOP,GoogleGeocodingAPI,EXACT_UPJ
State of Maryland,MD,STATE,Direct government,Maryland,State of Maryland,39.0457549,-76.64127119999999,"Maryland, USA",ChIJ35Dx6etNtokRsfZVdmU3r_I,APPROXIMATE,GoogleGeocodingAPI,EXACT_ISSUER
State of Michigan,MI,STATE,Direct government,Michigan,State of Michigan,42.7336274,-84.55539440000001,"100 N Capitol Ave, Lansing, MI 48933, USA",ChIJG_4fx9fBIogRzK2YacbutBY,ROOFTOP,GoogleGeocodingAPI,EXACT_ISSUER
State of Montana,MT,STATE,Direct government,Montana,State of Montana,45.4361039,-104.0654932,"Capitol, MT 59319, USA",ChIJsZyWo40DLlMRjX02BBes36k,APPROXIMATE,GoogleGeocodingAPI,EXACT_ISSUER
State of Nevada,NV,STATE,Direct government,Nevada,State of Nevada,38.8026097,-116.419389,"Nevada, USA",ChIJcbTe-KEKmYARs5X8qooDR88,APPROXIMATE,GoogleGeocodingAPI,EXACT_ISSUER
State of Nevada Department of Business & Industry,NV,STATE,Department,Nevada,State of Nevada,38.8026097,-116.419389,"Nevada, USA",ChIJcbTe-KEKmYARs5X8qooDR88,APPROXIMATE,GoogleGeocodingAPI,EXACT_UPJ
State of Ohio,OH,STATE,Direct government,Ohio,State of Ohio,40.0060889,-83.0282624,"281 W Lane Ave, Columbus, OH 43210, USA",ChIJs6fo3Y-OOIgRj4dWIQjYLKs,ROOFTOP,GoogleGeocodingAPI,EXACT_ISSUER
State of Oregon,OR,STATE,Direct government,Oregon,State of Oregon,44.9384539,-123.0303428,"900 Court St NE, Salem, OR 97301, USA",ChIJ6e-4xhP_v1QRSaCuO6TWQyg,ROOFTOP,GoogleGeocodingAPI,EXACT_ISSUER
State of Rhode Island,RI,STATE,Direct government,Rhode Island,State of Rhode Island,41.8307662,-71.4153037,"82 Smith St, Providence, RI 02903, USA",ChIJM9tqVxpF5IkRbTsEJXUPUk4,ROOFTOP,GoogleGeocodingAPI,EXACT_ISSUER
State of Texas,TX,STATE,Direct government,Texas,State of Texas,30.2746652,-97.7403505,"1100 Congress Ave., Austin, TX 78701, USA",ChIJz42sFKC1RIYROdCVpyJXb8s,ROOFTOP,GoogleGeocodingAPI,EXACT_ISSUER
State of Vermont,VT,STATE,Direct government,Vermont,State of Vermont,44.26246,-72.5803691,"115 State St, Montpelier, VT 05633, USA",ChIJ79D85IyntUwREEkLZRb0W_Q,ROOFTOP,GoogleGeocodingAPI,EXACT_ISSUER
State of Washington,WA,STATE,Direct government,Washington,State of Washington,47.0359422,-122.9044453,"Washington State Capitol Building, 416 Sid Snyder Ave SW, Olympia, WA 98504, USA",ChIJdSCDzv10kVQRHJ4tYFkIlQA,ROOFTOP,GoogleGeocodingAPI,EXACT_ISSUER
State of Wisconsin Clean Water Fund Leveraged Loan Portfolio,WI,STATE,Trust/Fund,Wisconsin,State of Wisconsin,43.0747008,-89.3841491,"2 E Main St, Madison, WI 53702, USA",ChIJ5YH4falWBogR5Lpub1B0OVA,ROOFTOP,GoogleGeocodingAPI,EXACT_UPJ
State of Wisconsin Environmental Improvement Fund Revenue,WI,STATE,State agency,Wisconsin,State of Wisconsin,43.0747008,-89.3841491,"2 E Main St, Madison, WI 53702, USA",ChIJ5YH4falWBogR5Lpub1B0OVA,ROOFTOP,GoogleGeocodingAPI,EXACT_UPJ
Stockton Public Financing Authority,CA,CITY,Financing authority,Stockton,City of Stockton,37.956995,-121.2916822,"425 N El Dorado St, Stockton, CA 95202, USA",ChIJKXah0J0SkIARM4okFGQ6370,ROOFTOP,GoogleGeocodingAPI,EXACT_UPJ
Stonewall Ranch Municipal Utility District,TX,SPECIAL_DISTRICT,Special district,Stonewall Ranch,Stonewall Ranch,29.6505529,-98.6287184,"Stonewall Ranch, San Antonio, TX 78256, USA",ChIJ-Qaa6whlXIYRQYklZ0gef1g,APPROXIMATE,GoogleGeocodingAPI,EXACT_ISSUER
Summerfield Lebanon Mascoutah Water Commission St Clair County,IL,MULTI_JURISDICTIONAL,Regional commission,"Summerfield, Lebanon, Mascoutah (IL)","Summerfield, Lebanon, Mascoutah (IL)",38.609796,-89.8130026,"Summerfield St, Lebanon, IL 62254, USA",ChIJbarO3_8IdogRAgDHMpuiQWc,GEOMETRIC_CENTER,GoogleGeocodingAPI,FUZZY_ISSUER
Summit County Development Finance Authority,OH,COUNTY,Financing authority,"Summit County, OH","Summit County, OH",41.0918991,-81.5596427,"Summit County, OH, USA",ChIJ78mtsLLUNogR7OHKeZgJcSM,APPROXIMATE,GoogleGeocodingAPI,FUZZY_ISSUER
Sumter County Industrial Development Authority/AL,AL,COUNTY,Development corporation,"Sumter County, AL","Sumter County, AL",32.6155551,-88.24611829999999,"Sumter County, AL, USA",ChIJBaj-z6azhYgReMa-IhlPLB4,APPROXIMATE,GoogleGeocodingAPI,FUZZY_ISSUER
Sunbelt Fresh Water Supply District,TX,SPECIAL_DISTRICT,Special district,Sunbelt,Sunbelt,29.8892623,-95.4027054,"410 W Gulf Bank Rd, Houston, TX 77037, USA",ChIJiX-35iLIQIYRrOYgW5q9xK0,ROOFTOP,GoogleGeocodingAPI,EXACT_ISSUER
Sunnyvale Financing Authority,CA,CITY,Financing authority,Sunnyvale,City of Sunnyvale,37.3716117,-122.0372694,"456 W Olive Ave, Sunnyvale, CA 94086, USA",ChIJ0z-QgcWDt4cR6NVkBUvM8f4,ROOFTOP,GoogleGeocodingAPI,EXACT_UPJ
Sustainable Energy Utility Inc,DE,STATE,State agency,Delaware,State of Delaware,39.157332,-75.5196563,"411 Legislative Ave, Dover, DE 19901, USA",ChIJsRcSxalkx4kRfhD5P6BqQaQ,ROOFTOP,GoogleGeocodingAPI,FUZZY_UPJ
Tangipahoa Sewerage District No 1,LA,SPECIAL_DISTRICT,Special district,Tangipahoa Parish,Tangipahoa Parish,30.4471773,-90.4353072,"N 1st St, Louisiana 70454, USA",ChIJGT-Xz7w8J4YRvxz9cCM3i6s,GEOMETRIC_CENTER,GoogleGeocodingAPI,FUZZY_ISSUER
Tattor Municipal Road District/TX,TX,SPECIAL_DISTRICT,Special district,Harris County (TX),Harris County (TX),33.6672185,-97.3516558,"Cooke County, TX, USA",ChIJNx0mIcKmTYYRxV-8JFisk-c,APPROXIMATE,GoogleGeocodingAPI,FUZZY_ISSUER
Terrebonne Levee & Conservation District Sales Tax Revenue,LA,SPECIAL_DISTRICT,Special district,Terrebonne Parish,Terrebonne Parish,29.5957696,-90.7195348,"Houma, Terrebonne Parish, Louisiana, 70363, United States",,,Nominatim/OSM,EXACT_ISSUER
Texas County R-IV School District Cabool,MO,SCHOOL_DISTRICT,School district,Texas County R-IV,Texas County R-IV,37.1501019,-92.1057549,"Cabool R-IV School District, MO, USA",ChIJU81yQnRy0IcR5ZnxUJXew0Y,APPROXIMATE,GoogleGeocodingAPI,FUZZY_ISSUER
Texas Department of Housing & Community Affairs,TX,STATE,Department,Texas,State of Texas,30.2746652,-97.7403505,"1100 Congress Ave., Austin, TX 78701, USA",ChIJz42sFKC1RIYROdCVpyJXb8s,ROOFTOP,GoogleGeocodingAPI,EXACT_UPJ
Texas Water Development Board,TX,STATE,State agency,Texas,State of Texas,30.2746652,-97.7403505,"1100 Congress Ave., Austin, TX 78701, USA",ChIJz42sFKC1RIYROdCVpyJXb8s,ROOFTOP,GoogleGeocodingAPI,EXACT_UPJ
Three Rivers Levee Improvement Authority,CA,SPECIAL_DISTRICT,Special district,Three Rivers,Three Rivers,36.778261,-119.4179324,"California, USA",ChIJPV4oX_65j4ARVW8IJ6IJUYs,APPROXIMATE,GoogleGeocodingAPI,EXACT_ISSUER
Three Rivers Regional Wastewater Authority,WA,MULTI_JURISDICTIONAL,Regional commission,Three Rivers Region,Three Rivers Region,46.2481686,-122.7920554,"Headquarters, WA 98611, USA",ChIJoUIFkiwQlFQRWs2w3-WZzJQ,APPROXIMATE,GoogleGeocodingAPI,EXACT_ISSUER
Timber Lane Utility District,TX,SPECIAL_DISTRICT,Special district,Timber Lane,Timber Lane,30.0434461,-95.4033433,"1902 Naplechase Crest Dr, Spring, TX 77373, USA",ChIJGZI5wDTLQIYRDZ3O3sycEx0,ROOFTOP,GoogleGeocodingAPI,EXACT_ISSUER
Toledo-Lucas County Port Authority,OH,COUNTY,Authority/Agency,Toledo-Lucas County,Toledo-Lucas County,41.6528052,-83.5378674,"Toledo, OH, USA",ChIJeU4e_C2HO4gRRcM6RZ_IPHw,APPROXIMATE,GoogleGeocodingAPI,EXACT_ISSUER
Town of Albany LA Water & Sewer System Revenue,LA,CITY,Direct government,Albany,Town of Albany,30.50435779999999,-90.5823138,"Albany, LA, USA",ChIJabkj8v7fJoYRJJuLFUFIxf4,APPROXIMATE,GoogleGeocodingAPI,EXACT_UPJ
Town of Ashland MA,MA,CITY,Direct government,Ashland,City of Ashland,42.2612067,-71.4633956,"Ashland, MA, USA",ChIJ00HFB4eK44kRm0SQRdnDwwE,APPROXIMATE,GoogleGeocodingAPI,FUZZY_ISSUER
Town of Eastham MA,MA,CITY,Direct government,Eastham,City of Eastham,41.8565388,-69.9870492,"Eastham, MA, USA",ChIJNx4gZ-xo-4kR3dokIUKJpAQ,APPROXIMATE,GoogleGeocodingAPI,FUZZY_ISSUER
Town of Franklinton LA Water & Sewer Revenue,LA,CITY,Direct government,Franklinton,Town of Franklinton,30.8471283,-90.153141,"Franklinton, LA 70438, USA",ChIJPfytvH53J4YReuhsCNU0pn8,APPROXIMATE,GoogleGeocodingAPI,EXACT_UPJ
Town of Miami Lakes FL Stormwater Utility System Revenue,FL,CITY,Direct government,Miami Lakes,Town of Miami Lakes,25.9087056,-80.30866189999999,"Miami Lakes, FL, USA",ChIJbw0_OX272YgR4-dy1EwCwDs,APPROXIMATE,GoogleGeocodingAPI,EXACT_UPJ
Town of Norton MA,MA,CITY,Direct government,Norton,City of Norton,41.9695328,-71.18212439999999,"Norton, MA 02766, USA",ChIJjVstKWWK5IkRxYou8cJvOro,APPROXIMATE,GoogleGeocodingAPI,FUZZY_ISSUER
Town of Otis MA,MA,CITY,Direct government,Otis,City of Otis,42.1926855,-73.09343679999999,"1 N Main Rd, Otis, MA 01253, USA",ChIJkzanxs1q54kRVdvrjKv-O_c,ROOFTOP,GoogleGeocodingAPI,FUZZY_ISSUER
Town of Schererville IN Sewage Works Revenue,IN,CITY,Direct government,Schererville,Town of Schererville,41.4789246,-87.4547605,"Schererville, IN, USA",ChIJhdtWjfLjEYgROkymlhrqFdw,APPROXIMATE,GoogleGeocodingAPI,EXACT_UPJ
Town of South Hadley MA,MA,CITY,Direct government,South Hadley,City of South Hadley,42.2591729,-72.57479339999999,"South Hadley, MA 01075, USA",ChIJUcMo2lPa5okRrwsd8BUAz84,APPROXIMATE,GoogleGeocodingAPI,FUZZY_ISSUER
Town of Wareham MA,MA,CITY,Direct government,Wareham,City of Wareham,41.7606622,-70.7211336,"Wareham, MA, USA",ChIJaba-LKfG5IkRI0ihlKYr9Jk,APPROXIMATE,GoogleGeocodingAPI,FUZZY_ISSUER
Town of Watertown MA,MA,CITY,Direct government,Watertown,City of Watertown,42.3709299,-71.1828321,"Watertown, MA, USA",ChIJfdAx9hx444kRJW7GUCLxRV8,APPROXIMATE,GoogleGeocodingAPI,FUZZY_ISSUER
Town of Wellfleet MA,MA,CITY,Direct government,Wellfleet,City of Wellfleet,41.9423205,-70.0256402,"Wellfleet, MA, USA",ChIJ38Vox9xC-4kRsBK11rY5oRc,APPROXIMATE,GoogleGeocodingAPI,FUZZY_ISSUER
Town of York NY,NY,CITY,Direct government,York,City of York,42.8710697,-77.8856212,"York, NY, USA",ChIJoWXB0LNf0YkRu50qqAOem7k,APPROXIMATE,GoogleGeocodingAPI,FUZZY_ISSUER
Township of Radnor PA,PA,CITY,Direct government,Radnor Township,Radnor Township,40.043912,-75.3754599,"Radnor Township, PA, USA",ChIJZzwKzVOVxokRNGkbchlu6mI,APPROXIMATE,GoogleGeocodingAPI,FUZZY_ISSUER
Transbay Joint Powers Authority,CA,MULTI_JURISDICTIONAL,Authority/Agency,San Francisco Bay Area,San Francisco Bay Area,37.7898133,-122.3962033,"425 Mission St # 250, San Francisco, CA 94105, USA",ChIJjX82gWSAhYAR4scc-5egBv4,ROOFTOP,GoogleGeocodingAPI,EXACT_ISSUER
Travis County Municipal Utility District No 14,TX,SPECIAL_DISTRICT,Special district,Travis County,Travis County,30.5084906,-97.6325394,"2601 Forest Creek Dr, Round Rock, TX 78665, USA",ChIJQ4fnghXQRIYRYnmIxGNHBus,ROOFTOP,GoogleGeocodingAPI,FUZZY_ISSUER
Travis County Municipal Utility District No 17,TX,SPECIAL_DISTRICT,Special district,Travis County,Travis County,30.5084906,-97.6325394,"2601 Forest Creek Dr, Round Rock, TX 78665, USA",ChIJQ4fnghXQRIYRYnmIxGNHBus,ROOFTOP,GoogleGeocodingAPI,FUZZY_ISSUER
Travis County Water Control & Improvement District No 17,TX,SPECIAL_DISTRICT,Special district,Travis County,Travis County,30.2097015,-97.6982272,"Travis County, TX, USA",ChIJddG_PMCwRIYRO50oSjlkdJA,APPROXIMATE,GoogleGeocodingAPI,FUZZY_ISSUER
Trego County Rural Water District No 2,KS,SPECIAL_DISTRICT,Special district,Trego County,Trego County,38.9900316,-99.8124935,"Trego County, KS, USA",ChIJPerenrwGoYcRPe9IsIzl2Qs,APPROXIMATE,GoogleGeocodingAPI,FUZZY_ISSUER
Trenton Public Schools School District,NJ,SCHOOL_DISTRICT,School district,Trenton Public Schools,Trenton Public Schools,40.2219013,-74.7629661,"Trenton City School District, Trenton, NJ, USA",ChIJtTUMbsxZwYkRfJo6Q2rxH8s,APPROXIMATE,GoogleGeocodingAPI,EXACT_ISSUER
Tri-County Regional Water Distribution District,AR,MULTI_JURISDICTIONAL,Regional commission,Tri-County Region,Tri-County Region,35.3424278,-93.1307429,"5306 N Arkansas Ave, Russellville, AR 72802, USA",ChIJm6-_e_ZSzIcRI1DS9N9BIf4,ROOFTOP,GoogleGeocodingAPI,EXACT_ISSUER
Tri-Valley School District,SD,SCHOOL_DISTRICT,School district,Tri-Valley,Tri-Valley,43.7698518,-96.9638624,"Tri-Valley School District 49-6, SD, USA",ChIJx-6VwQ0wiYcRzQfrTuup9I8,APPROXIMATE,GoogleGeocodingAPI,EXACT_ISSUER
Triborough Bridge & Tunnel Authority,NY,STATE,Authority/Agency,New York,State of New York,40.7127753,-74.0059728,"New York, NY, USA",ChIJOwg_06VPwokRYv534QaPC8g,APPROXIMATE,GoogleGeocodingAPI,EXACT_UPJ
Trinity Public Utilities District,CA,SPECIAL_DISTRICT,Special district,Trinity County (CA),Trinity County (CA),40.7126279,-122.925476,"PO Box 1416, 26 Ponderosa Ln, Weaverville, CA 96093, USA",ChIJa6F5FM1T0lQRInVOahgJfFM,ROOFTOP,GoogleGeocodingAPI,EXACT_ISSUER
Triview Metropolitan District,CO,MULTI_JURISDICTIONAL,Regional commission,Triview Metropolitan District,Triview Metropolitan District,39.067427,-104.8484636,"16055 Old Forest Point STE 300, Monument, CO 80132, USA",ChIJx43musOtbIcRZCwVRJLzh3A,ROOFTOP,GoogleGeocodingAPI,EXACT_ISSUER
Trust for Cultural Resources of The City of New York/The,NY,CITY,Trust/Fund,New York City,City of New York City,40.7012709,-73.80702250000002,"92-16 147th Pl, Jamaica, NY 11435, USA",ChIJWzlSScVgwokRGA3SjJWAlG8,ROOFTOP,GoogleGeocodingAPI,FUZZY_ISSUER
Tualatin Hills Park & Recreation District,OR,SPECIAL_DISTRICT,Special district,Beaverton area (OR),Beaverton area (OR),45.520298,-122.8372986,"Tualatin Hills Park & Recreation District, 15707 SW Walker Rd, Beaverton, OR 97006, USA",ChIJXcaWuSAPlVQR9zcWcTxIRXQ,ROOFTOP,GoogleGeocodingAPI,EXACT_ISSUER
Unicoi County Water Utility District,TN,COUNTY,Authority/Agency,Unicoi County,Unicoi County,36.073032,-82.5185837,"Unicoi County, TN, USA",ChIJUVTfKpBvWogR7fifASuvo7Y,APPROXIMATE,GoogleGeocodingAPI,EXACT_ISSUER
Union Township Board of Education/Union County,NJ,SCHOOL_DISTRICT,School district,Union Township,Union Township,40.6963917,-74.2699775,"Union, NJ, USA",ChIJm6qdb5-tw4kRTAVvGSoycAU,APPROXIMATE,GoogleGeocodingAPI,FUZZY_UPJ
University Area Joint Authority Sewer Revenue,PA,MULTI_JURISDICTIONAL,Authority/Agency,University Area (PA),University Area (PA),41.2033216,-77.1945247,"Pennsylvania, USA",ChIJieUyHiaALYgRPbQiUEchRsI,APPROXIMATE,GoogleGeocodingAPI,FUZZY_ISSUER
University of Arizona/The,AZ,STATE,Public university,Arizona/The,State of Arizona,33.4480967,-112.0970236,"1700 W Washington St, Phoenix, AZ 85007, USA",ChIJZaHOni0SK4cRroxWdOv1J3Q,ROOFTOP,GoogleGeocodingAPI,EXACT_UPJ
University of Arkansas,AR,STATE,Public university,Arkansas,State of Arkansas,34.7469598,-92.28905,"500 Woodlane St, Little Rock, AR 72201, USA",ChIJlak53Fu70ocR-0-Av2EQh3c,ROOFTOP,GoogleGeocodingAPI,EXACT_UPJ
University of Cincinnati,OH,STATE,Public university,Ohio,State of Ohio,39.1014537,-84.5124602,"Cincinnati, Hamilton County, Ohio, United States",,,Nominatim/OSM,EXACT_ISSUER
University of Colorado,CO,STATE,Public university,Colorado,State of Colorado,39.73932509999999,-104.9848069,"200 E Colfax Ave, Denver, CO 80203, USA",ChIJGclBlCp5bIcRjwqRDQIXohI,ROOFTOP,GoogleGeocodingAPI,EXACT_UPJ
University of Michigan,MI,STATE,Public university,Michigan,State of Michigan,42.7336274,-84.55539440000001,"100 N Capitol Ave, Lansing, MI 48933, USA",ChIJG_4fx9fBIogRzK2YacbutBY,ROOFTOP,GoogleGeocodingAPI,EXACT_UPJ
University of Nebraska Facilities Corp/The,NE,STATE,Public university,Nebraska Facilities Corp/The,State of Nebraska,40.8079243,-96.6997142,"1445 K St, Lincoln, NE 68508, USA",ChIJEZQDF_m-locRmpgAh227SJo,ROOFTOP,GoogleGeocodingAPI,EXACT_UPJ
University of North Dakota,ND,STATE,Public university,North Dakota,State of North Dakota,47.5514926,-101.0020119,"North Dakota, USA",ChIJY-nYVxKD11IRyc9egzmahA0,APPROXIMATE,GoogleGeocodingAPI,EXACT_UPJ
