Issuer_Name,State_Abb,Jurisdiction_Type,Entity_Type,Controlling_Jurisdiction,Ultimate_Political_Jurisdiction,lat,lng,formatted_address,place_id,location_type,geo_source,match_method
Lakeport Municipal Financing Agency,CA,CITY,Financing authority,Lakeport,City of Lakeport,39.0434075,-122.914406,"225 Park St, Lakeport, CA 95453, USA",ChIJU_ETyuXlg4ARBWjSyJOPAVs,ROOFTOP,GoogleGeocodingAPI,EXACT_UPJ
Lakes Fresh Water Supply District of Denton County,TX,SPECIAL_DISTRICT,Special district,Denton County,Denton County,33.1418611,-97.179026,"Denton County, TX, USA",ChIJXQTukxTTTYYR08hsTrvOVUM,APPROXIMATE,GoogleGeocodingAPI,EXACT_ISSUER
Lakeside Municipal Utility District No 3,TX,SPECIAL_DISTRICT,Special district,Lakeside,Lakeside,31.9685988,-99.9018131,"Texas, USA",ChIJSTKCCzZwQIYRPN4IGI8c6xY,APPROXIMATE,GoogleGeocodingAPI,FUZZY_ISSUER
Lakewood Ranch Stewardship District Utility Revenue,FL,SPECIAL_DISTRICT,Special district,Lakewood Ranch,Lakewood Ranch,28.6008513,-81.2142963,"3501 Quadrangle Blvd Suite 270, Orlando, FL 32817, USA",ChIJVVUlZPdo54gRkOq8l8BDcAs,ROOFTOP,GoogleGeocodingAPI,FUZZY_ISSUER
Lancaster Power Authority,CA,CITY,Public utility,Lancaster,City of Lancaster,34.6991411,-118.1453724,"44933 Fern Ave, Lancaster, CA 93534, USA",ChIJb1WmQs5awoAR-rp4nGfMYJk,ROOFTOP,GoogleGeocodingAPI,EXACT_UPJ
Lansing School District,MI,SCHOOL_DISTRICT,School district,Lansing,Lansing,42.7296905,-84.5593643,"519 W Kalamazoo St, Lansing, MI 48933, USA",ChIJBWbL5NPBIogRr_HLYaw6gX8,ROOFTOP,GoogleGeocodingAPI,EXACT_ISSUER
Lawrence County Regional Water District,AR,MULTI_JURISDICTIONAL,Regional commission,Lawrence County,Lawrence County,35.9969735,-91.135302,"Lawrence County, AR, USA",ChIJPfbgG8u71ocRQEvPnZLAzG8,APPROXIMATE,GoogleGeocodingAPI,EXACT_ISSUER
Leslie County School District Finance Corp,KY,SCHOOL_DISTRICT,School district,Leslie County,Leslie County,37.0698286,-83.3789389,"Leslie County School District, KY, USA",ChIJpzQ6ViBNW4gReHcVSuF1BMA,APPROXIMATE,GoogleGeocodingAPI,FUZZY_ISSUER
Lexington-Fayette Urban County Government,KY,CITY,Direct government,Lexington,City of Lexington,38.0447166,-84.4955823,"200 E Main St, Lexington, KY 40507, USA",ChIJAVJiXulEQogRz8_S7eYOkXw,ROOFTOP,GoogleGeocodingAPI,EXACT_ISSUER
Ligonier Valley School District,PA,SCHOOL_DISTRICT,School district,Ligonier Valley,Ligonier Valley,40.32723860000001,-79.1548533,"Ligonier Valley School District, PA, USA",ChIJzX4thG8ly4kR5h7fKlq1dxY,APPROXIMATE,GoogleGeocodingAPI,EXACT_ISSUER
Livingston County School District Finance Corp,KY,SCHOOL_DISTRICT,School district,Livingston County,Livingston County,37.2431347,-88.362785,"Livingston County School District, KY, USA",ChIJS3CI5y93eogRVCeERP2i6yk,APPROXIMATE,GoogleGeocodingAPI,FUZZY_ISSUER
Livingston Parish Sewer District,LA,COUNTY,Special district,"Livingston Parish, LA","Livingston Parish, LA",30.4340146,-90.6773046,"Livingston Parish, LA, USA",ChIJi8YzDO_XJoYR9jhF2ILMmrk,APPROXIMATE,GoogleGeocodingAPI,FUZZY_ISSUER
Lonedell R-XIV School District,MO,SCHOOL_DISTRICT,School district,Lonedell R-XIV,Lonedell R-XIV,38.2502508,-90.8484524,"Lonedell R-xiv, MO, USA",ChIJsTzPoc0V2YcRapqjnW13z9M,APPROXIMATE,GoogleGeocodingAPI,EXACT_ISSUER
Long Branch Board of Education,NJ,SCHOOL_DISTRICT,School district,Long Branch,Long Branch,40.2994572,-74.0003966,"540 Broadway, Long Branch, NJ 07740, USA",ChIJNeSIeRYlwokRitHacPvhXjU,ROOFTOP,GoogleGeocodingAPI,EXACT_ISSUER
Long Island Power Authority,NY,STATE,Public utility,New York,State of New York,40.7127753,-74.0059728,"New York, NY, USA",ChIJOwg_06VPwokRYv534QaPC8g,APPROXIMATE,GoogleGeocodingAPI,EXACT_UPJ
Los Angeles County Development Authority,CA,COUNTY,Development corporation,Los Angeles County,Los Angeles County,34.3871821,-118.1122679,"Los Angeles County, CA, USA",ChIJMc1kAdMq3YARKjm9z9YofYM,APPROXIMATE,GoogleGeocodingAPI,EXACT_UPJ
Los Angeles County Metropolitan Transportation Authority Sales Tax Revenue,CA,MULTI_JURISDICTIONAL,Regional commission,Los Angeles County,Los Angeles County,34.3871821,-118.1122679,"Los Angeles County, CA, USA",ChIJMc1kAdMq3YARKjm9z9YofYM,APPROXIMATE,GoogleGeocodingAPI,EXACT_UPJ
Los Angeles County Public Works Financing Authority,CA,COUNTY,Financing authority,Los Angeles County Public Works,Los Angeles County Public Works,34.3871821,-118.1122679,"Los Angeles County, CA, USA",ChIJMc1kAdMq3YARKjm9z9YofYM,APPROXIMATE,GoogleGeocodingAPI,FUZZY_ISSUER
Los Angeles County Sanitation Districts Financing Authority,CA,SPECIAL_DISTRICT,Special district,Los Angeles County,Los Angeles County,34.033036,-118.0221321,"1955 Workman Mill Rd, Whittier, CA 90601, USA",ChIJ2eD3Ei3RwoARtYY_QFyuKvY,ROOFTOP,GoogleGeocodingAPI,EXACT_ISSUER
Los Angeles Department of Water & Power,CA,CITY,Department,Los Angeles,City of Los Angeles,34.0537136,-118.2426533,"200 N Spring St, Los Angeles, CA 90012, USA",ChIJjzUBO0_GwoARrO_fJmtVI1c,ROOFTOP,GoogleGeocodingAPI,EXACT_UPJ
Louisiana Local Government Environmental Facilities & Community Development Auth,LA,STATE,State agency,Louisiana,State of Louisiana,30.5190775,-91.5208624,"Louisiana, USA",ChIJZYIRslSkIIYRA0flgTL3Vck,APPROXIMATE,GoogleGeocodingAPI,EXACT_UPJ
Louisiana Public Facilities Authority,LA,STATE,Financing authority,Louisiana,State of Louisiana,30.5190775,-91.5208624,"Louisiana, USA",ChIJZYIRslSkIIYRA0flgTL3Vck,APPROXIMATE,GoogleGeocodingAPI,EXACT_UPJ
Louisville and Jefferson County Metropolitan Sewer District,KY,CITY,Special district,Louisville,City of Louisville,40.6940971,-73.9845211,"15 MetroTech Center #15, Brooklyn, NY 11201, USA",ChIJW_6G50pawokRkIsJB1mhj4U,ROOFTOP,GoogleGeocodingAPI,FUZZY_ISSUER
Lower Colorado River Authority,TX,STATE,State agency,Texas,State of Texas,30.2746652,-97.7403505,"1100 Congress Ave., Austin, TX 78701, USA",ChIJz42sFKC1RIYROdCVpyJXb8s,ROOFTOP,GoogleGeocodingAPI,EXACT_UPJ
Lucia Mar Unified School District,CA,SCHOOL_DISTRICT,School district,Lucia Mar,Lucia Mar,35.1234145,-120.3896651,"Lucia Mar Unified School District, CA, USA",ChIJVU3uELJl7IARlkNKCl7lbIA,APPROXIMATE,GoogleGeocodingAPI,EXACT_ISSUER
Lynwood Utility Authority,CA,CITY,Authority/Agency,Lynwood,City of Lynwood,33.9263507,-118.1989287,"11330 Bullis Rd, Lynwood, CA 90262, USA",ChIJ4V6YznDMwoARlwOpRG8kjjI,ROOFTOP,GoogleGeocodingAPI,EXACT_UPJ
Lyon County School District Finance Corp,KY,SCHOOL_DISTRICT,School district,Lyon County,Lyon County,37.0247261,-88.0900762,"Lyon County School District, KY, USA",ChIJWZCveQSMeogRygE2mBEz9dY,APPROXIMATE,GoogleGeocodingAPI,FUZZY_ISSUER
Macoupin & Madison Counties Community Unit School District No 8 Bunker Hill,IL,MULTI_JURISDICTIONAL,School district,Macoupin & Madison Counties Community Unit,Macoupin & Madison Counties Community Unit,39.0429345,-89.95148069999999,"Bunker Hill, IL 62014, USA",ChIJ82S0GaWLdYgRcfaNfbrSKTs,APPROXIMATE,GoogleGeocodingAPI,EXACT_ISSUER
Madison Bond Etc Counties Community Unit School District No 5 Highland,IL,MULTI_JURISDICTIONAL,School district,Madison Bond Etc Counties Community Unit,Madison Bond Etc Counties Community Unit,39.6368201,-83.91089680000002,"Xenia Community City School District, OH, USA",ChIJS-LgaVG9QIgRiZLzLghXCYQ,APPROXIMATE,GoogleGeocodingAPI,FUZZY_ISSUER
Madison County Board of Education/AL,AL,SCHOOL_DISTRICT,School district,"Madison County, AL","Madison County, AL",37.7143001,-84.3121264,"Madison County, KY, USA",ChIJodMOu4_hQogRKRR7Xp5Vt9Y,APPROXIMATE,GoogleGeocodingAPI,FUZZY_ISSUER
Madison County Community Unit School District No 7 Edwardsville,IL,SCHOOL_DISTRICT,School district,Madison County Community Unit,Madison County Community Unit,37.7143001,-84.3121264,"Madison County, KY, USA",ChIJodMOu4_hQogRKRR7Xp5Vt9Y,APPROXIMATE,GoogleGeocodingAPI,FUZZY_ISSUER
Madison County School District/GA,GA,SCHOOL_DISTRICT,School district,"Madison County, GA","Madison County, GA",37.7143001,-84.3121264,"Madison County, KY, USA",ChIJodMOu4_hQogRKRR7Xp5Vt9Y,APPROXIMATE,GoogleGeocodingAPI,FUZZY_ISSUER
Madison County Water District,KY,COUNTY,Authority/Agency,Madison County,Madison County,37.7143001,-84.3121264,"Madison County, KY, USA",ChIJodMOu4_hQogRKRR7Xp5Vt9Y,APPROXIMATE,GoogleGeocodingAPI,FUZZY_ISSUER
Madison Local School District/Lake County,OH,SCHOOL_DISTRICT,School district,Madison Local,Madison Local,37.7143001,-84.3121264,"Madison County, KY, USA",ChIJodMOu4_hQogRKRR7Xp5Vt9Y,APPROXIMATE,GoogleGeocodingAPI,FUZZY_ISSUER
Maine Governmental Facilities Authority,ME,STATE,Financing authority,Maine,State of Maine,44.30717380000001,-69.7818272,"Maine State House, Augusta, ME 04333, USA",ChIJE5_i9rUGskwR_u_-oN8gt3Y,ROOFTOP,GoogleGeocodingAPI,EXACT_UPJ
Maine State Housing Authority,ME,STATE,Authority/Agency,Maine,State of Maine,44.30717380000001,-69.7818272,"Maine State House, Augusta, ME 04333, USA",ChIJE5_i9rUGskwR_u_-oN8gt3Y,ROOFTOP,GoogleGeocodingAPI,EXACT_UPJ
Manasquan Board of Education,NJ,SCHOOL_DISTRICT,School district,Manasquan,Manasquan,40.12886839999999,-74.04792479999999,"169 Broad St, Manasquan, NJ 08736, USA",ChIJIZ1_UsuHwYkR-zOUprerJl4,ROOFTOP,GoogleGeocodingAPI,EXACT_ISSUER
Maricopa County Industrial Development Authority,AZ,COUNTY,Development corporation,Maricopa County,Maricopa County,33.2917968,-112.4291464,"Maricopa County, AZ, USA",ChIJ_6JyBQxdK4cRgEgsf9Ec7Eo,APPROXIMATE,GoogleGeocodingAPI,EXACT_UPJ
Maricopa County School District No 83-Cartwright Elementary,AZ,SCHOOL_DISTRICT,School district,Maricopa County,Maricopa County,33.2917968,-112.4291464,"Maricopa County, AZ, USA",ChIJ_6JyBQxdK4cRgEgsf9Ec7Eo,APPROXIMATE,GoogleGeocodingAPI,EXACT_UPJ
Maryland Economic Development Corp,MD,STATE,Development corporation,Maryland,State of Maryland,39.0457549,-76.64127119999999,"Maryland, USA",ChIJ35Dx6etNtokRsfZVdmU3r_I,APPROXIMATE,GoogleGeocodingAPI,EXACT_UPJ
Maryland Stadium Authority,MD,STATE,State agency,Maryland,State of Maryland,39.0457549,-76.64127119999999,"Maryland, USA",ChIJ35Dx6etNtokRsfZVdmU3r_I,APPROXIMATE,GoogleGeocodingAPI,EXACT_UPJ
Maryland Water Infrastructure Financing Administration Bay Restoration Fund,MD,STATE,State agency,Maryland,State of Maryland,39.0457549,-76.64127119999999,"Maryland, USA",ChIJ35Dx6etNtokRsfZVdmU3r_I,APPROXIMATE,GoogleGeocodingAPI,EXACT_UPJ
Marysville Joint Unified School District,CA,SCHOOL_DISTRICT,School district,Marysville Joint,Marysville Joint,39.3571237,-121.3084088,"Marysville Joint Unified School District, CA, USA",ChIJfWRIo8ygnIARN0Fk_PfTank,APPROXIMATE,GoogleGeocodingAPI,EXACT_ISSUER
Massachusetts Clean Energy Cooperative Corp,MA,STATE,State agency,Massachusetts,State of Massachusetts,42.4072107,-71.3824374,"Massachusetts, USA",ChIJ_b9z6W1l44kRHA2DVTbQxkU,APPROXIMATE,GoogleGeocodingAPI,EXACT_ISSUER
Massachusetts Municipal Wholesale Electric Co,MA,MULTI_JURISDICTIONAL,Public utility,Massachusetts Municipalities,Massachusetts Municipalities,42.1917981,-72.50901569999999,"327 Moody St, Ludlow, MA 01056, USA",ChIJe5jDeUjD5okR0M3sIogUzcg,ROOFTOP,GoogleGeocodingAPI,FUZZY_ISSUER
Mattabassett District,CT,MULTI_JURISDICTIONAL,Special district,"Cromwell, Berlin, Middletown, Rocky Hill (CT)","Cromwell, Berlin, Middletown, Rocky Hill (CT)",41.5845099,-72.6499639,"245 Main St, Cromwell, CT 06416, USA",ChIJN3dVV7pL5okRd42_q1Olquc,ROOFTOP,GoogleGeocodingAPI,EXACT_ISSUER
McCracken County School District Finance Corp,KY,SCHOOL_DISTRICT,School district,McCracken County,McCracken County,37.0763937,-88.7493998,"McCracken County School District, KY, USA",ChIJy8lblgwceogR1q63Z1LIGmY,APPROXIMATE,GoogleGeocodingAPI,FUZZY_ISSUER
McKinleyville Community Service District,CA,SPECIAL_DISTRICT,Special district,McKinleyville,McKinleyville,40.9358069,-124.0999133,"1656 Sutter Rd, McKinleyville, CA 95519, USA",ChIJUyUX-Ipa0VQRCZNyI7f9I6k,ROOFTOP,GoogleGeocodingAPI,FUZZY_ISSUER
Mcguffey School District,PA,SCHOOL_DISTRICT,School district,Mcguffey,Mcguffey,40.1149582,-80.4103957,"McGuffey School District, PA, USA",ChIJu9QoSW-3NYgRb3LPcJh-Zkw,APPROXIMATE,GoogleGeocodingAPI,FUZZY_ISSUER
Melvindale Northern Allen Park Public Schools,MI,SCHOOL_DISTRICT,School district,Melvindale Northern Allen Park,Melvindale Northern Allen Park,42.27548660000001,-83.1916937,"Melvindale-North Allen Park School District, MI, USA",ChIJ31exZSM0O4gRPAwpWUStKKc,APPROXIMATE,GoogleGeocodingAPI,EXACT_ISSUER
Mendota Joint Powers Financing Authority,CA,MULTI_JURISDICTIONAL,Authority/Agency,Mendota,Mendota,36.7535611,-120.3815574,"Mendota, CA 93640, USA",ChIJmWR6DA6Pk4AR62x05-YQ970,APPROXIMATE,GoogleGeocodingAPI,EXACT_ISSUER
Metropolitan Atlanta Rapid Transit Authority,GA,MULTI_JURISDICTIONAL,Regional commission,Atlanta Metropolitan Area,Atlanta Metropolitan Area,33.7870489,-84.3870491,"Red/Gold Line, Atlanta, GA, USA",ChIJM0Xmq7YF9YgRpwbLP-quy1k,GEOMETRIC_CENTER,GoogleGeocodingAPI,EXACT_ISSUER
Metropolitan Government of Nashville & Davidson County TN Water & Sewer Revenue,TN,CITY,Department,Nashville,City of Nashville,35.5954562,-82.54838,"Asheville, NC 28801, USA",ChIJqRmB-FjzWYgRYDYnEB399WA,GEOMETRIC_CENTER,GoogleGeocodingAPI,FUZZY_UPJ
Metropolitan Pier & Exposition Authority,IL,MULTI_JURISDICTIONAL,Regional commission,Chicago Metropolitan Area,Chicago Metropolitan Area,40.6331249,-89.3985283,"Illinois, USA",ChIJGSZubzgtC4gRVlkRZFCCFX8,APPROXIMATE,GoogleGeocodingAPI,FUZZY_ISSUER
Metropolitan Transportation Authority,NY,STATE,Authority/Agency,New York,State of New York,40.7127753,-74.0059728,"New York, NY, USA",ChIJOwg_06VPwokRYv534QaPC8g,APPROXIMATE,GoogleGeocodingAPI,EXACT_UPJ
Metropolitan Transportation Authority Dedicated Tax Fund,NY,STATE,Authority/Agency,New York,State of New York,40.7127753,-74.0059728,"New York, NY, USA",ChIJOwg_06VPwokRYv534QaPC8g,APPROXIMATE,GoogleGeocodingAPI,EXACT_UPJ
Metropolitan Water Reclamation District of Greater Chicago,IL,SPECIAL_DISTRICT,Regional commission,Greater Chicago,Greater Chicago,41.8942604,-87.6251068,"100 E Erie St, Chicago, IL 60611, USA",ChIJpQ7iwKwsDogRmBxKQ3SvcV8,ROOFTOP,GoogleGeocodingAPI,EXACT_ISSUER
Michigan Finance Authority,MI,STATE,Financing authority,Michigan,State of Michigan,42.7336274,-84.55539440000001,"100 N Capitol Ave, Lansing, MI 48933, USA",ChIJG_4fx9fBIogRzK2YacbutBY,ROOFTOP,GoogleGeocodingAPI,EXACT_UPJ
Michigan Strategic Fund,MI,STATE,State agency,Michigan,State of Michigan,42.7336274,-84.55539440000001,"100 N Capitol Ave, Lansing, MI 48933, USA",ChIJG_4fx9fBIogRzK2YacbutBY,ROOFTOP,GoogleGeocodingAPI,EXACT_UPJ
Mid Valley School District,PA,SCHOOL_DISTRICT,School district,Mid Valley,Mid Valley,41.456379,-75.6091696,"Mid Valley School District, PA, USA",ChIJA4eaRDbaxIkRhLXya3tuWaM,APPROXIMATE,GoogleGeocodingAPI,EXACT_ISSUER
Mid-Arkansas Utilities Public Water Authority,AR,SPECIAL_DISTRICT,Special district,Mid-Arkansas Utilities Public,Mid-Arkansas Utilities Public,35.20105,-91.8318334,"Arkansas, USA",ChIJYSc_dD-e0ocR0NLf_z5pBaQ,APPROXIMATE,GoogleGeocodingAPI,EXACT_ISSUER
Midpeninsula Regional Open Space District Field Employees Corp,CA,SPECIAL_DISTRICT,Regional commission,Midpeninsula Region,Midpeninsula Region,37.396388,-122.1045587,"5050 El Camino Real, Los Altos, CA 94022, USA",ChIJNXV36h6uj4ARq7dBSiUAEyI,ROOFTOP,GoogleGeocodingAPI,FUZZY_ISSUER
Millcreek-Richland Joint Authority,PA,MULTI_JURISDICTIONAL,Authority/Agency,Millcreek-Richland,Millcreek-Richland,40.3547881,-76.25660169999999,"Richland, PA, USA",ChIJXQBcD0EPxokRZ8zzKfc3-y4,APPROXIMATE,GoogleGeocodingAPI,EXACT_ISSUER
Millville Area School District,PA,SCHOOL_DISTRICT,School district,Millville Area,Millville Area,41.120363,-76.5299495,"Millville, Columbia County, Pennsylvania, 17846, United States",,,Nominatim/OSM,EXACT_ISSUER
Milwaukee Metropolitan Sewerage District,WI,CITY,Regional commission,Milwaukee,City of Milwaukee,43.041751,-87.90975639999999,"200 E Wells St, Milwaukee, WI 53202, USA",ChIJB6jqzAsZBYgRGpS-aSrojMY,ROOFTOP,GoogleGeocodingAPI,EXACT_UPJ
Milwaukee Redevelopment Authority,WI,CITY,Development corporation,Milwaukee,City of Milwaukee,43.041751,-87.90975639999999,"200 E Wells St, Milwaukee, WI 53202, USA",ChIJB6jqzAsZBYgRGpS-aSrojMY,ROOFTOP,GoogleGeocodingAPI,EXACT_UPJ
Minnesota Agricultural & Economic Development Board,MN,STATE,Development corporation,Minnesota,State of Minnesota,44.9551923,-93.1019519,"Minnesota State Capitol, 75 Rev Dr Martin Luther King Jr Boulevard., St Paul, MN 55155, USA",ChIJ2Qha5qsq9ocRk0Jv3NQ8Msc,ROOFTOP,GoogleGeocodingAPI,EXACT_UPJ
Minnesota Higher Education Facilities Authority,MN,STATE,Financing authority,Minnesota,State of Minnesota,44.9551923,-93.1019519,"Minnesota State Capitol, 75 Rev Dr Martin Luther King Jr Boulevard., St Paul, MN 55155, USA",ChIJ2Qha5qsq9ocRk0Jv3NQ8Msc,ROOFTOP,GoogleGeocodingAPI,EXACT_UPJ
Minnesota Public Facilities Authority State Revolving Fund,MN,STATE,State agency,Minnesota,State of Minnesota,44.9551923,-93.1019519,"Minnesota State Capitol, 75 Rev Dr Martin Luther King Jr Boulevard., St Paul, MN 55155, USA",ChIJ2Qha5qsq9ocRk0Jv3NQ8Msc,ROOFTOP,GoogleGeocodingAPI,EXACT_UPJ
Mission Bend Municipal Utility District No 2,TX,SPECIAL_DISTRICT,Special district,Mission Bend,Mission Bend,29.6938429,-95.6649468,"Mission Bend, TX, USA",ChIJt4YdYmreQIYRdIoOQGyOHBk,APPROXIMATE,GoogleGeocodingAPI,FUZZY_ISSUER
Mission Economic Development Corp,TX,CITY,Development corporation,Mission,City of Mission,39.0187819,-94.6540367,"6090 Woodson Rd, Mission, KS 66202, USA",ChIJC4KeXC3swIcRQjP7gknu1Yc,ROOFTOP,GoogleGeocodingAPI,EXACT_UPJ
Mississippi Business Finance Corp,MS,STATE,Financing authority,Mississippi,State of Mississippi,32.30348,-90.1821462,"400 High St, Jackson, MS 39201, USA",ChIJuQuxCVQyKIYRbNgjoF_x7Tk,ROOFTOP,GoogleGeocodingAPI,EXACT_UPJ
Mississippi Development Bank,MS,STATE,Bond bank,Mississippi,State of Mississippi,32.30348,-90.1821462,"400 High St, Jackson, MS 39201, USA",ChIJuQuxCVQyKIYRbNgjoF_x7Tk,ROOFTOP,GoogleGeocodingAPI,EXACT_UPJ
Missouri Clean Energy District,MO,STATE,State agency,Missouri,State of Missouri,37.9642529,-91.8318334,"Missouri, USA",ChIJfeMiSNXmwIcRcr1mBFnEW7U,APPROXIMATE,GoogleGeocodingAPI,EXACT_ISSUER
Missouri Joint Municipal Electric Utility Commission,MO,MULTI_JURISDICTIONAL,Authority/Agency,Missouri Municipal Region,Missouri Municipal Region,37.9642529,-91.8318334,"Missouri, USA",ChIJfeMiSNXmwIcRcr1mBFnEW7U,APPROXIMATE,GoogleGeocodingAPI,EXACT_ISSUER
Missouri State Environmental Improvement & Energy Resources Authority,MO,STATE,State agency,Missouri,State of Missouri,38.5790295,-92.1732042,"201 W Capitol Ave, Jefferson City, MO 65101, USA",ChIJLVgOqlde24cRC0-jJlmiKcM,ROOFTOP,GoogleGeocodingAPI,EXACT_UPJ
Monona Grove School District/WI,WI,SCHOOL_DISTRICT,School district,Monona Grove,Monona Grove,43.0748965,-89.18964299999999,"Monona Grove School District, WI, USA",ChIJ9-OHVLRbBogRPzTRw9GByGs,APPROXIMATE,GoogleGeocodingAPI,FUZZY_ISSUER
Monroe County Intermediate School District,MI,SCHOOL_DISTRICT,School district,Monroe County Intermediate,Monroe County Intermediate,41.923927,-83.467023,"1101 S Raisinville Rd, Monroe, MI 48161, USA",ChIJwQ3osvxkO4gRDOhMobonyfg,ROOFTOP,GoogleGeocodingAPI,EXACT_ISSUER
Monterey Park Financing Authority,CA,CITY,Financing authority,Monterey Park,City of Monterey Park,34.0590361,-118.1256391,"320 W Newmark Ave, Monterey Park, CA 91754, USA",ChIJt8WpsVnFwoAR3Ijj1f7oRpw,ROOFTOP,GoogleGeocodingAPI,EXACT_UPJ
Monterey Regional Waste Management Authority,CA,MULTI_JURISDICTIONAL,Regional commission,Monterey Region,Monterey Region,36.5871457,-121.8462322,"Monterey Regional Airport (MRY), 200 Fred Kane Dr, Monterey, CA 93940, USA",ChIJNzjrAAbljYARditzx-x9Poc,ROOFTOP,GoogleGeocodingAPI,EXACT_ISSUER
Montgomery County Housing Opportunities Commission,MD,COUNTY,Authority/Agency,Montgomery County,Montgomery County,30.1432231,-95.4161437,"1710 Ashton Village Dr, Spring, TX 77386, USA",ChIJVVWZ3XQ2R4YR28mC3oef5NU,ROOFTOP,GoogleGeocodingAPI,FUZZY_UPJ
Montgomery County Municipal Utility District No 112,TX,SPECIAL_DISTRICT,Special district,Montgomery County,Montgomery County,30.1432231,-95.4161437,"1710 Ashton Village Dr, Spring, TX 77386, USA",ChIJVVWZ3XQ2R4YR28mC3oef5NU,ROOFTOP,GoogleGeocodingAPI,FUZZY_ISSUER
Montgomery County Municipal Utility District No 119,TX,SPECIAL_DISTRICT,Special district,Montgomery County,Montgomery County,30.1432231,-95.4161437,"1710 Ashton Village Dr, Spring, TX 77386, USA",ChIJVVWZ3XQ2R4YR28mC3oef5NU,ROOFTOP,GoogleGeocodingAPI,FUZZY_ISSUER
Montgomery County Municipal Utility District No 128A,TX,SPECIAL_DISTRICT,Special district,Montgomery County,Montgomery County,30.1432231,-95.4161437,"1710 Ashton Village Dr, Spring, TX 77386, USA",ChIJVVWZ3XQ2R4YR28mC3oef5NU,ROOFTOP,GoogleGeocodingAPI,FUZZY_ISSUER
Montgomery County Municipal Utility District No 15,TX,SPECIAL_DISTRICT,Special district,Montgomery County,Montgomery County,30.1432231,-95.4161437,"1710 Ashton Village Dr, Spring, TX 77386, USA",ChIJVVWZ3XQ2R4YR28mC3oef5NU,ROOFTOP,GoogleGeocodingAPI,FUZZY_ISSUER
Montgomery County Municipal Utility District No 94,TX,SPECIAL_DISTRICT,Special district,Montgomery County,Montgomery County,30.1432231,-95.4161437,"1710 Ashton Village Dr, Spring, TX 77386, USA",ChIJVVWZ3XQ2R4YR28mC3oef5NU,ROOFTOP,GoogleGeocodingAPI,FUZZY_ISSUER
Montgomery County Municipal Utility District No 96,TX,SPECIAL_DISTRICT,Special district,Montgomery County,Montgomery County,30.1432231,-95.4161437,"1710 Ashton Village Dr, Spring, TX 77386, USA",ChIJVVWZ3XQ2R4YR28mC3oef5NU,ROOFTOP,GoogleGeocodingAPI,FUZZY_ISSUER
Montgomery County School District Finance Corp,KY,SCHOOL_DISTRICT,School District Finance Corporation,Montgomery County Board of Education,Montgomery County School District,38.3172361,-84.56414699999999,"Scott County School District, KY, USA",ChIJFcUFGcI9QogRMZf5-FWA35g,APPROXIMATE,GoogleGeocodingAPI,FUZZY_ISSUER
Montgomery County Utility District No 3,TX,SPECIAL_DISTRICT,Special district,Montgomery County,Montgomery County,29.7554839,-95.3615297,"Norton Rose Fulbright, 1301 McKinney St # 5100, Houston, TX 77010, USA",ChIJ__-vXiO_QIYRrg5rFzl-qcU,ROOFTOP,GoogleGeocodingAPI,FUZZY_ISSUER
Morenci Area Schools,MI,SCHOOL_DISTRICT,School district,Morenci,Morenci,41.7540082,-84.20679919999999,"Morenci Area Schools, MI, USA",ChIJ2bPVl5lVPIgRQTdyuWIRkVo,APPROXIMATE,GoogleGeocodingAPI,EXACT_ISSUER
Morgan County School District Finance Corp,KY,SCHOOL_DISTRICT,School district,Morgan County,Morgan County,38.3172361,-84.56414699999999,"Scott County School District, KY, USA",ChIJFcUFGcI9QogRMZf5-FWA35g,APPROXIMATE,GoogleGeocodingAPI,FUZZY_ISSUER
Morgantown Utility Board Inc,WV,CITY,Public utility,Morgantown,City of Morgantown,39.6304154,-79.9544476,"389 Spruce St, Morgantown, WV 26505, USA",ChIJf6rZH317NYgRKLehBhP4lT0,ROOFTOP,GoogleGeocodingAPI,EXACT_UPJ
Morningstar Ranch Municipal Utility District No 1 of Parker County,TX,SPECIAL_DISTRICT,Special district,Morningstar Ranch (Parker County),Morningstar Ranch (Parker County),32.7499647,-97.6000435,"128 Heather Wind Ln, Aledo, TX 76008, USA",ChIJNT29tE8PToYRJhk_Ubnuvic,ROOFTOP,GoogleGeocodingAPI,FUZZY_ISSUER
Mountain House Public Financing Authority,CA,CITY,Financing authority,Mountain House,City of Mountain House,37.7793901,-121.543234,"Mountain House, CA, USA",ChIJcY5QEcwekIARx1VVxdn7pg4,APPROXIMATE,GoogleGeocodingAPI,EXACT_ISSUER
Mountaintop Area Joint Sanitary Authority,PA,MULTI_JURISDICTIONAL,Authority/Agency,Mountaintop Area,Mountaintop Area,41.1148399,-75.9598075,"290 Morio Dr, Mountain Top, PA 18707, USA",ChIJGRZ-KBgJxYkRdnl72JXIltE,ROOFTOP,GoogleGeocodingAPI,EXACT_ISSUER
Murray Independent School District Finance Corp,KY,SCHOOL_DISTRICT,School district,Murray,Murray,36.6029858,-88.3190717,"Murray Independent School District, KY 42071, USA",ChIJnXEri61SeogRZdoSPeUxIf4,APPROXIMATE,GoogleGeocodingAPI,FUZZY_ISSUER
Nebraska Utilities Corp,NE,STATE,Financing authority,Nebraska,State of Nebraska,40.8079243,-96.6997142,"1445 K St, Lincoln, NE 68508, USA",ChIJEZQDF_m-locRmpgAh227SJo,ROOFTOP,GoogleGeocodingAPI,EXACT_UPJ
New Hampshire Business Finance Authority,NH,STATE,Financing authority,New Hampshire,State of New Hampshire,43.2069126,-71.5380717,"107 N Main St, Concord, NH 03301, USA",ChIJz1KMm24T4okR2vP7vswQBhA,ROOFTOP,GoogleGeocodingAPI,EXACT_UPJ
New Jersey Economic Development Authority,NJ,STATE,Financing authority,New Jersey,State of New Jersey,40.22022940000001,-74.7703719,"125 W State St, Trenton, NJ 08608, USA",ChIJlciGxdFZwYkR1WIktFmJoYk,ROOFTOP,GoogleGeocodingAPI,EXACT_UPJ
New Jersey Educational Facilities Authority,NJ,STATE,Financing authority,New Jersey,State of New Jersey,40.22022940000001,-74.7703719,"125 W State St, Trenton, NJ 08608, USA",ChIJlciGxdFZwYkR1WIktFmJoYk,ROOFTOP,GoogleGeocodingAPI,EXACT_UPJ
New Jersey Infrastructure Bank,NJ,STATE,Bond bank,New Jersey,State of New Jersey,40.22022940000001,-74.7703719,"125 W State St, Trenton, NJ 08608, USA",ChIJlciGxdFZwYkR1WIktFmJoYk,ROOFTOP,GoogleGeocodingAPI,EXACT_UPJ
New Mexico Finance Authority,NM,STATE,Financing authority,New Mexico,State of New Mexico,35.6822308,-105.9394865,"490 Old Santa Fe Trail, Santa Fe, NM 87501, USA",ChIJa0ByuENQGIcRsQvb-k5g2Ao,ROOFTOP,GoogleGeocodingAPI,EXACT_UPJ
New Mexico Institute of Mining & Technology,NM,STATE,Public university,New Mexico,State of New Mexico,35.6822308,-105.9394865,"490 Old Santa Fe Trail, Santa Fe, NM 87501, USA",ChIJa0ByuENQGIcRsQvb-k5g2Ao,ROOFTOP,GoogleGeocodingAPI,EXACT_UPJ
New York Liberty Development Corp,NY,STATE,Development corporation,New York,State of New York,40.7127753,-74.0059728,"New York, NY, USA",ChIJOwg_06VPwokRYv534QaPC8g,APPROXIMATE,GoogleGeocodingAPI,EXACT_UPJ
New York Power Authority,NY,STATE,Public utility,New York,State of New York,40.7127753,-74.0059728,"New York, NY, USA",ChIJOwg_06VPwokRYv534QaPC8g,APPROXIMATE,GoogleGeocodingAPI,EXACT_UPJ
New York State Dormitory Authority,NY,STATE,Financing authority,New York,State of New York,40.7127753,-74.0059728,"New York, NY, USA",ChIJOwg_06VPwokRYv534QaPC8g,APPROXIMATE,GoogleGeocodingAPI,EXACT_UPJ
New York State Energy Research & Development Authority,NY,STATE,Development corporation,New York,State of New York,40.7127753,-74.0059728,"New York, NY, USA",ChIJOwg_06VPwokRYv534QaPC8g,APPROXIMATE,GoogleGeocodingAPI,EXACT_UPJ
